{
  "id": "sys_ghost_factory_demo",
  "schema_version": "1.0",
  "name": "ghost-factory-demo",
  "kind": "repository",
  "environment": "staging",
  "owner": "demo-team",
  "capabilities": ["events.write", "findings.read", "rebuttals.write"],
  "adapter": "http",
  "metadata": {
    "repository": "example/ghost-factory-demo",
    "default_branch": "main",
    "registered_commit": "abc123",
    "description": "Synthetic Ghost Factory demonstration system from SPEC 21."
  },
  "created_at": "2026-10-19T09:00:00Z",
  "status": "active"
}
